{"$schema":"https://json-schema.org/draft-07/schema#","description":"Common structure every COS-FP-A fixture validates against. `assertion` names the synthetic-harness property; `kind` pins the algorithm to cosfp. Per-fixture pins: COS-FP-A-001 carries the content-type + grid stratification; COS-FP-A-002 pins digest determinism; COS-FP-A-003 pins the no-fabrication fallback; COS-FP-A-004 pins the exact < vs >= off-by-one threshold boundary; COS-FP-A-005 pins flag-off byte-identity.","properties":{"assertion":{"type":"string"},"boundary":{"properties":{"hi":{"type":"number"},"lo":{"type":"number"}},"type":"object"},"byte_identical":{"type":"boolean"},"content_types":{"items":{"enum":["code","prose","mixed"],"type":"string"},"type":"array"},"fabricated_fp":{"type":"boolean"},"fabricated_threshold":{"type":"boolean"},"flag":{"type":"string"},"flag_enabled":{"type":"boolean"},"grid":{"properties":{"hi":{"type":"number"},"lo":{"type":"number"},"points":{"type":"integer"},"step":{"type":"number"}},"type":"object"},"id":{"type":"string"},"kind":{"enum":["cosfp"],"type":"string"},"l2_cosine":{"type":"string"},"no_data":{"type":"string"},"override_enabled":{"type":"boolean"},"per_type_fp_fractions":{"items":{"maximum":1,"minimum":0,"type":"number"},"type":"array"},"producer":{"type":"string"},"report_digest_sha256":{"type":"string"},"same_corpus_same_digest":{"type":"boolean"},"schema":{"type":"string"},"seed_invariant":{"type":"boolean"},"status":{"enum":["ok","no_data"],"type":"string"},"strict_straddle":{"type":"boolean"}},"required":["id","producer","assertion","kind","schema"],"title":"COS-FP-A synthetic FP harness + L2 cosine threshold calibration fixture envelope","type":"object"}
