{"assertion":"determinism — same seed + same params yield a byte-identical report digest SHA-256 across two identical runs","id":"COS-FP-A-002","kind":"cosfp","producer":"scripts/cosine-fp/gen-fixtures.mjs","report_digest_sha256":"2312c120c43c75ff46db9fc8f362c25df879a54862790d8d2cbac2e88466d646","same_corpus_same_digest":true,"schema":"schemas/cosfp-fixture.schema.json","seed_invariant":true}
